{
  "$schema": "../video-script.schema.json",
  "metadata": {
    "title": "MyApp - All-in-One Project Management",
    "description": "90-second landing page teaser showcasing how MyApp eliminates project management chaos",
    "version": "1.0.0",
    "created_at": "2026-02-02T14:30:00Z",
    "updated_at": "2026-02-02T15:45:00Z",
    "author": "claude-code-harness/generate-video",
    "project": "myapp",
    "video_type": "lp-teaser",
    "tags": ["product-demo", "landing-page", "social-media"],
    "scenario_id": "myapp-demo-2026-02-02"
  },
  "scenes": [
    {
      "scene_id": "intro-welcome",
      "section_id": "hook",
      "order": 0,
      "type": "intro",
      "content": {
        "text": "Tired of juggling multiple tools?",
        "duration_ms": 5000,
        "title": "MyApp",
        "subtitle": "All-in-One Project Management"
      },
      "direction": {
        "transition": {
          "in": "fade",
          "out": "fade",
          "duration_ms": 500
        },
        "background": {
          "type": "gradient",
          "value": "linear-gradient(135deg, #667eea 0%, #764ba2 100%)"
        }
      },
      "assets": [
        {
          "type": "image",
          "source": "assets/generated/intro.png",
          "generated": true
        }
      ],
      "template": "intro"
    },
    {
      "scene_id": "problem-statement",
      "section_id": "problem-promise",
      "order": 1,
      "type": "problem-promise",
      "content": {
        "text": "Teams waste hours switching between tools, losing context, and missing deadlines.",
        "duration_ms": 10000
      },
      "direction": {
        "transition": {
          "in": "slide",
          "out": "fade",
          "duration_ms": 500
        }
      },
      "assets": []
    },
    {
      "scene_id": "workflow-demo",
      "section_id": "workflow",
      "order": 2,
      "type": "ui-demo",
      "content": {
        "duration_ms": 30000,
        "url": "http://localhost:3000/dashboard",
        "actions": [
          {
            "type": "wait",
            "value": 1000
          },
          {
            "type": "click",
            "selector": "[data-testid='create-project']"
          },
          {
            "type": "type",
            "selector": "input[name='project-name']",
            "value": "Website Redesign"
          },
          {
            "type": "click",
            "selector": "[data-testid='add-task']"
          }
        ]
      },
      "direction": {
        "transition": {
          "in": "fade",
          "out": "fade",
          "duration_ms": 500
        }
      },
      "assets": [],
      "audio": {
        "narration": {
          "text": "With MyApp, create projects, assign tasks, and track progress—all in one place.",
          "file": "audio/narration/workflow-01.mp3",
          "start_offset_ms": 1000
        }
      }
    },
    {
      "scene_id": "unique-feature",
      "section_id": "differentiator",
      "order": 3,
      "type": "feature-highlight",
      "content": {
        "text": "Real-time collaboration with AI-powered insights",
        "duration_ms": 15000,
        "title": "Intelligent Automation"
      },
      "direction": {
        "transition": {
          "in": "zoom",
          "out": "fade",
          "duration_ms": 500
        },
        "emphasis": {
          "effect": "pulse",
          "timing": "3s"
        }
      },
      "assets": [
        {
          "type": "image",
          "source": "assets/generated/ai-feature.png",
          "generated": true
        }
      ]
    },
    {
      "scene_id": "final-cta",
      "section_id": "cta",
      "order": 4,
      "type": "cta",
      "content": {
        "text": "Start your free trial today",
        "duration_ms": 5000,
        "url": "https://myapp.com/signup"
      },
      "direction": {
        "transition": {
          "in": "fade",
          "out": "fade",
          "duration_ms": 800
        },
        "background": {
          "type": "solid",
          "value": "#667eea"
        }
      },
      "assets": [
        {
          "type": "image",
          "source": "assets/generated/cta-button.png",
          "generated": true
        }
      ],
      "template": "cta"
    }
  ],
  "total_duration_ms": 65000,
  "output_settings": {
    "width": 1920,
    "height": 1080,
    "fps": 30,
    "codec": "h264",
    "format": "mp4",
    "quality": "high",
    "preset": "1080p",
    "bitrate": "8M"
  },
  "audio_settings": {
    "bgm": {
      "file": "public/BGM/upbeat-corporate.mp3",
      "volume": 0.25,
      "fade_in_ms": 1000,
      "fade_out_ms": 2000,
      "loop": true
    },
    "master_volume": 1.0
  },
  "branding": {
    "logo": "public/logo.svg",
    "colors": {
      "primary": "#667eea",
      "secondary": "#764ba2",
      "accent": "#f093fb",
      "background": "#1a202c",
      "text": "#ffffff"
    },
    "fonts": {
      "primary": "Inter",
      "secondary": "Roboto",
      "monospace": "Fira Code"
    }
  },
  "transitions": {
    "default_duration_ms": 500,
    "overlap_ms": 450,
    "type": "fade"
  },
  "notes": "90-second LP teaser following the pain→solution→CTA narrative structure"
}
