{
  "metadata": {
    "title": "Test Video",
    "version": "1.0.0",
    "created_at": "2026-02-02T17:26:50.194Z",
    "video_type": "custom"
  },
  "scenes": [
    {
      "scene_id": "test-scene-1",
      "section_id": "intro",
      "order": 0,
      "type": "intro",
      "content": {
        "text": "Hello World",
        "duration_ms": 3000,
        "title": "Test",
        "subtitle": "E2E Test"
      },
      "direction": {
        "transition": {
          "in": "fade",
          "out": "fade",
          "duration_ms": 500
        },
        "background": {
          "type": "solid",
          "value": "#000000"
        }
      },
      "assets": [],
      "template": "intro"
    },
    {
      "scene_id": "test-scene-2",
      "section_id": "content",
      "order": 1,
      "type": "text",
      "content": {
        "text": "This is a test scene",
        "duration_ms": 2000
      },
      "direction": {
        "transition": {
          "in": "fade",
          "out": "fade",
          "duration_ms": 500
        }
      },
      "assets": []
    }
  ],
  "total_duration_ms": 5000,
  "output_settings": {
    "width": 1280,
    "height": 720,
    "fps": 30,
    "codec": "h264",
    "format": "mp4",
    "quality": "medium"
  }
}